<?xml version="1.0" encoding="utf-8" standalone="no"?>
<!DOCTYPE game_library SYSTEM "./Xml_scheme/Schema.dtd">
<game_library>
    <game>
        <id code ='G1'> </id>
        
        <game_header>
            <game_name> League of Legends </game_name>
            <price>0.00</price>
                <manufacturer>
                    <name>Riot games</name>
                <location> USA </location>
                <salary> 1000000.00</salary>
                </manufacturer>
        </game_header>

        <game_details> 
            <summary> Moba game </summary>
            <publish_date>
               <date year="2009"/>
            </publish_date>
            <age_restriction>
                13+
            </age_restriction>
            <operational_system type="Windows"/>
            <rating>
                8.0
            </rating>
            <genres>
                <genre name="Action"/>
            </genres>
            <language name="English"/>
        
            <publisher> Riot Games </publisher>
            <authors>
                <author>
                    <author_name> Tom Cadwell </author_name>
                    <biography> none </biography>
                    <published_games> League of Legends </published_games>
                    <nationality>American</nationality>
                    <birth_day>
                        <date day="3" month="7" year="1981"/>
                    </birth_day>
                    <death_day>
                        <date day="0" month="0" year="0"/>
                    </death_day>
                </author>
            </authors>
        </game_details>       
    </game>    
</game_library>    
